<?xml version="1.0" encoding="UTF-8"?>
<!-- edited with XML Spy v4.3 U (http://www.xmlspy.com) by Jim Arlow (Mountain Way Limited) -->
<?xml-stylesheet type="text/xsl" href="D:\cvt\Protected\Business Archetype Book\UseCaseSchema2\UseCaseXSL1.xsl"?>
<UseCase xmlns:xsi="http://www.w3.org/2001/XMLSchema-instance" xsi:noNamespaceSchemaLocation="D:\cvt\Protected\Business Archetype Book\UseCaseSchema2\UseCase.xsd">
	<Preface>
		<Name>CreateNewCustomer</Name>
		<ID>UC2</ID>
		<Actors>
			<ActorID>Customer</ActorID>
		</Actors>
		<Summary>Create a new customer record.</Summary>
	</Preface>
	<MainFlow>
		<Preconditions>
			<Precondition>The Customer is not logged on to the system</Precondition>
		</Preconditions>
		<FlowElements>
			<FlowElement>
				<Step>The use case begins when the Customer selects "New Customer".</Step>
			</FlowElement>
			<FlowElement>
				<Step>The system asks the Customer to enter a user name and password.</Step>
			</FlowElement>
			<FlowElement>
				<Step>The Customer enters the requested information.</Step>
			</FlowElement>
			<FlowElement>
				<Step>The system checks to see if the user name is available and the password is valid.</Step>
			</FlowElement>
			<FlowElement>
				<While condition="the username is not available or the password is invalid">
					<WhileElement>
						<Step>The system asks for a new user name and/or password.</Step>
					</WhileElement>
					<WhileElement>
						<While condition="Test">
							<WhileElement>
								<Step>The system asks for a new user name and/or password.</Step>
							</WhileElement>
						</While>
					</WhileElement>
				</While>
			</FlowElement>
			<FlowElement>
				<Step>The system asks the Customer for the following information: name and address (mandatory), shipping address (optional), email address (mandatory), phone number (optional), fax number (optional), credit card details (mandatory)</Step>
			</FlowElement>
			<FlowElement>
				<Step>The Customer enters the requested information.</Step>
			</FlowElement>
			<FlowElement>
				<While condition="mandatory information is missing">
					<WhileElement>
						<Step>The sytem asks the Customer for the missing information.</Step>
					</WhileElement>
					<WhileElement>
						<Step>The Customer enters the missing information.</Step>
					</WhileElement>
				</While>
			</FlowElement>
			<FlowElement>
				<Step>The system confirms that the customer information has been accepted.</Step>
			</FlowElement>
			<FlowElement>
				<Step>The system assigns a unique customer identifier to the customer.</Step>
			</FlowElement>
		</FlowElements>
		<Postconditions>
			<Postcondition>A new customer record has been created.</Postcondition>
			<Postcondition>The Customer is assigned a user name and password.</Postcondition>
			<Postcondition>The Customer is assigned a unique identifier.</Postcondition>
		</Postconditions>
	</MainFlow>
</UseCase>
